month,keywords
12,制造 加拿大 富虹 油品 一级 大豆油 美方 公民 套装 中方 量子 火车票 百雀羚 三生 护手霜 事情 春运 毛泽东 四号 孟晚 艾滋病 万人 诚信
11,团团 国际 儿童 快递 嘉宾 校园 企业 奋斗 博会 方向盘 志愿者 机动 提高 飞行 欺凌
10,加油 大桥 红领巾 新疆 港珠澳 重庆 部队 经济 比赛
9,山竹 瑞典 家乡 香港 广东 月饼 幼儿园 丰收 登陆 享年 农民 作家 特产 抽奖 奶茶 强台风 国庆 中秋 失信 深港
8,亚运会 选手 中国队 金牌 夺得 警察 顺风 亚运 近视 印尼 滴滴 电竞 自由泳 恭喜 金银铜 男童 答题卡 开学 孙杨 纪录 飞花
7,暴雨 通知书 小伙 父母 找到 奶奶 长生 生产 遗体 长春 人员 火星 一辆 泰国
6,时代 世界杯 俄罗斯 毒品 球迷 足球 回忆 校长 时光 粽子 毕业典礼 结束 环境 代表团 第十八次
5,高考 航母 微笑 汶川 十年 北京 机长 海上
4,叙利亚 华服 清明 四六级 英烈 毒品 化武 读作 举报 使馆 间谍 南京大学 文学院 公民 不好
3,会议 政府 国务院 十三届 樱花 全国人大 两会 总理 部长 大会 烈士 就业 中方 专业 残奥会 春分 主席 李克强 草案 委员 全国政协 福岛
2,男子 冬奥会 短道 平昌 速滑 中国队 决赛 选手 妈妈 拜年 年夜饭 爸妈 平台 接力 武大 韩国 礼物 媒体 官方 犯规 祝贺 道歉 景区 金牌
1,年前 回家 生活 早安 春节 台湾 加班 两岸 想要 正式 外交部 现场
